<?xml version="1.0"?>
<!DOCTYPE Report
[
<!ELEMENT Report (General ,(Doc|BPT)) >
<!ATTLIST Report ver CDATA #REQUIRED tmZone CDATA #REQUIRED>

<!ELEMENT General ( DocLocation ) >
<!ATTLIST General productName CDATA #REQUIRED productVer CDATA #REQUIRED os CDATA #REQUIRED host CDATA #REQUIRED qcserver CDATA #IMPLIED qcproject CDATA #IMPLIED SolManSolutionId CDATA #IMPLIED SolManProjectId CDATA #IMPLIED SolManTestPlanId CDATA #IMPLIED SolManTestPackageId CDATA #IMPLIED SolManUserInfoData CDATA #IMPLIED  >

<!ELEMENT BPT (DName,Res,DVer?,TSet?,TInst?,NodeArgs,AdditionalInfo*,Doc*) >
<!ATTLIST BPT rID ID #REQUIRED >

<!ELEMENT Doc (DName,ConfName?,Res,DVer?,TSet?,TInst?,RunType?,DT?,AdditionalInfo*,Step*,DIter*,Step*,Action*,Doc*,Summary?,TestMaintenanceSummary*,NodeArgs?) >
<!ATTLIST Doc rID ID #REQUIRED type (Test|BC|BPTWrapperTest|Flow|Group|Action) "Test" productName CDATA #REQUIRED BCIter CDATA #IMPLIED >

<!ELEMENT RunType ( #PCDATA )>
<!ATTLIST RunType fmStep (False|True) "False" batch (False|True) "False" upDesc (False|True) "False" upChk (False|True) "False" upAS (False|True) "False">

<!ELEMENT DName ( #PCDATA ) >

<!ELEMENT ConfName ( #PCDATA ) >

<!ELEMENT Res ( #PCDATA ) >

<!ELEMENT AdditionalInfo (AdditionalDataName,AdditionalDataValue ) >

<!ELEMENT AdditionalDataName ( #PCDATA ) >

<!ELEMENT AdditionalDataValue ( #PCDATA ) >

<!ELEMENT DVer ( #PCDATA ) >

<!ELEMENT TSet ( #PCDATA ) >

<!ELEMENT TInst ( #PCDATA ) >

<!ELEMENT DIter (Step*,Action+,Summary?,NodeArgs)>
<!ATTLIST DIter rID ID #REQUIRED iterID CDATA #REQUIRED>

<!ELEMENT DocLocation ( #PCDATA )>

<!ELEMENT Action (AName,AIter*,(Step|HtmlStep|Action)*, Summary,ActionMaintenanceSummary*, NodeArgs ) >
<!ATTLIST Action rID ID #REQUIRED>

<!ELEMENT AIter ((Step|HtmlStep|Action)*,DataMapping?, Summary?,NodeArgs) >
<!ATTLIST AIter rID ID #REQUIRED iterID CDATA #REQUIRED isCountable (False|True) "False" >

<!ELEMENT AName ( #PCDATA ) >

<!ELEMENT TestMaintenanceSummary (ActionMaintenanceSummary*) >
<!ATTLIST TestMaintenanceSummary ObjectsAdded CDATA #REQUIRED ObjectsUpdated CDATA #REQUIRED StepsUpdated CDATA #REQUIRED StepsComments CDATA #REQUIRED><!ELEMENT ActionMaintenanceSummary (ObjectChange* ) >
<!ATTLIST ActionMaintenanceSummary Action CDATA #REQUIRED Objects CDATA #REQUIRED Updated CDATA #REQUIRED LinesTotal CDATA #REQUIRED Added CDATA #REQUIRED LinesUpdated CDATA #REQUIRED>

<!ELEMENT ObjectChange  (Hierarchy, PropertyChangeList* ) >
<!ATTLIST ObjectChange Operation CDATA #IMPLIED OriginalRepository CDATA #IMPLIED>

<!ELEMENT PropertyChangeList (PropertyDef*) >

<!ELEMENT PropertyDef (OriginalValue, NewValue) >
<!ATTLIST PropertyDef PropName CDATA #REQUIRED OriginRegularExpression (True|False) "False" NewRegularExpression (True|False) "False" AddedProperty (True|False) "False" >

<!ELEMENT OriginalValue ( #PCDATA )>

<!ELEMENT NewValue ( #PCDATA )>

<!ELEMENT Hierarchy  (ObjectName, Hierarchy*) >
<!ATTLIST Hierarchy MicClass CDATA #REQUIRED>

<!ELEMENT ObjectName  ( #PCDATA ) >

<!ELEMENT Step (Obj,Details,Time,TimeTick* ,(Step|HtmlStep|Doc)*, DataMapping?, NodeArgs) >
<!ATTLIST Step rID ID #REQUIRED retval CDATA #IMPLIED>

<!ELEMENT HtmlStep (HTML,TimeTick*,(Step|HtmlStep|Doc)*,NodeArgs) >
<!ATTLIST HtmlStep rID ID #REQUIRED >

<!ELEMENT Obj ( #PCDATA ) >
<!ATTLIST Obj plainTxt (False|True) "True">

<!ELEMENT Details ( #PCDATA ) >
<!ATTLIST Details plainTxt (False|True) "True">

<!ELEMENT Time ( #PCDATA ) >

<!ELEMENT HTML ( #PCDATA ) >

<!ELEMENT Disp ( #PCDATA ) >

<!ELEMENT TimeTick ( #PCDATA ) >

<!ELEMENT DataMapping ( DataMappedItem* )>
<!ELEMENT DataMappedItem EMPTY >
<!ATTLIST DataMappedItem dsName CDATA #REQUIRED >
<!ATTLIST DataMappedItem rowId CDATA #REQUIRED >

<!ELEMENT NodeArgs (Disp,TopPane?,BtmPane?,ExtendedInfo? )>
<!ATTLIST NodeArgs eType CDATA #REQUIRED icon CDATA #REQUIRED nRep CDATA #REQUIRED UserNote CDATA #IMPLIED filter (False|True) "True">
<!ATTLIST NodeArgs status (Passed|Failed|Done|Warning|Information) "Done">
<!ATTLIST NodeArgs iconSel CDATA #IMPLIED nType CDATA #IMPLIED MovieMarker CDATA "">
<!ATTLIST NodeArgs Source CDATA #IMPLIED SourceLine CDATA #IMPLIED StepFlowItemKey CDATA #IMPLIED >

<!ELEMENT TopPane (Path)>

<!ELEMENT BtmPane ( (Path|WR)?,ASHilite?)>
<!ATTLIST BtmPane vType CDATA "HTML">

<!ELEMENT Path ( #PCDATA ) >

<!ELEMENT ASHilite ( #PCDATA ) >

<!ELEMENT WR ( #PCDATA ) >

<!ELEMENT ExtendedInfo ( StepData ) >

<!ATTLIST ExtendedInfo StepType CDATA #REQUIRED>
<!ELEMENT DT (NodeArgs) >
<!ATTLIST DT rID ID #REQUIRED>

<!ELEMENT Summary (Param*)>
<!ATTLIST Summary sTime CDATA #IMPLIED eTime CDATA #IMPLIED passed CDATA #IMPLIED failed CDATA #IMPLIED warnings CDATA #IMPLIED retval CDATA #IMPLIED stopped (False|True) "False" >

<!ELEMENT Param (ParamName,ParamVal)+ >
<!ATTLIST Param paramInOut (In|Out) "In">

<!ELEMENT ParamName ( #PCDATA ) >

<!ELEMENT ParamVal ( #PCDATA ) >

]
>
<Report ver="2.0" tmZone="India Standard Time">
<General productName="Micro Focus Unified Functional Testing" productVer="14.50" os="" host="LIN51009080"><DocLocation><![CDATA[C:\Users\BMANICHA\OneDrive - Capgemini\Documents\Unified Functional Testing\demo_1]]></DocLocation></General>
<Doc rID="T1"   productName= "Micro Focus Unified Functional Testing"  >
<DName><![CDATA[demo_1]]></DName>
<Res><![CDATA[Res3]]></Res>
<DT rID="T2">
<NodeArgs eType="Table" icon="2" nRep="4" filter="False" >
<Disp><![CDATA[Run-Time Data Table]]></Disp>
<BtmPane vType="Table" >
<Path><![CDATA[Default.xls]]></Path>
</BtmPane>
</NodeArgs>
</DT>
<DIter rID="T3" iterID="1" >
<Action rID="T4">
<AName><![CDATA[login]]></AName>
<Step rID="T5">
<Obj plainTxt="False" ><![CDATA[Micro Focus MyFlight Sample]]></Obj>
<Details plainTxt="False" ><![CDATA[WpfWindow]]></Details>
<Time><![CDATA[10-02-2023 - 10:45:18]]></Time>
<TimeTick>1676006118</TimeTick>
<Step rID="T6">
<Obj plainTxt="False" ><![CDATA[agentName.Set]]></Obj>
<Details plainTxt="False" ><![CDATA["john"]]></Details>
<Time><![CDATA[10-02-2023 - 10:45:18]]></Time>
<TimeTick>1676006118</TimeTick>
<NodeArgs eType="Replay" icon="6" nRep="10" Source="login" SourceLine="0" >
<Disp><![CDATA[agentName.Set]]></Disp>
</NodeArgs>
</Step>
<Step rID="T7">
<Obj plainTxt="False" ><![CDATA[password.SetSecure]]></Obj>
<Details plainTxt="False" ><![CDATA["63e0ec6c4a373555b9a9"]]></Details>
<Time><![CDATA[10-02-2023 - 10:45:18]]></Time>
<TimeTick>1676006118</TimeTick>
<NodeArgs eType="Replay" icon="6" nRep="12" Source="login" SourceLine="1" >
<Disp><![CDATA[password.SetSecure]]></Disp>
</NodeArgs>
</Step>
<Step rID="T8">
<Obj plainTxt="False" ><![CDATA[OK.Click]]></Obj>
<Details plainTxt="False" ><![CDATA[]]></Details>
<Time><![CDATA[10-02-2023 - 10:45:19]]></Time>
<TimeTick>1676006119</TimeTick>
<NodeArgs eType="Replay" icon="7" nRep="14" Source="login" SourceLine="2" >
<Disp><![CDATA[OK.Click]]></Disp>
</NodeArgs>
</Step>
<Step rID="T9">
<Obj plainTxt="False" ><![CDATA[fromCity.Select]]></Obj>
<Details plainTxt="False" ><![CDATA["Paris"]]></Details>
<Time><![CDATA[10-02-2023 - 10:45:20]]></Time>
<TimeTick>1676006120</TimeTick>
<NodeArgs eType="Replay" icon="8" nRep="16" Source="login" SourceLine="3" >
<Disp><![CDATA[fromCity.Select]]></Disp>
</NodeArgs>
</Step>
<Step rID="T10">
<Obj plainTxt="False" ><![CDATA[toCity.Select]]></Obj>
<Details plainTxt="False" ><![CDATA["London"]]></Details>
<Time><![CDATA[10-02-2023 - 10:45:21]]></Time>
<TimeTick>1676006121</TimeTick>
<NodeArgs eType="Replay" icon="8" nRep="18" Source="login" SourceLine="4" >
<Disp><![CDATA[toCity.Select]]></Disp>
</NodeArgs>
</Step>
<Step rID="T11">
<Obj plainTxt="False" ><![CDATA[Class.Select]]></Obj>
<Details plainTxt="False" ><![CDATA["Business"]]></Details>
<Time><![CDATA[10-02-2023 - 10:45:21]]></Time>
<TimeTick>1676006121</TimeTick>
<NodeArgs eType="Replay" icon="8" nRep="20" Source="login" SourceLine="5" >
<Disp><![CDATA[Class.Select]]></Disp>
</NodeArgs>
</Step>
<Step rID="T12">
<Obj plainTxt="False" ><![CDATA[numOfTickets.Select]]></Obj>
<Details plainTxt="False" ><![CDATA["2"]]></Details>
<Time><![CDATA[10-02-2023 - 10:45:22]]></Time>
<TimeTick>1676006122</TimeTick>
<NodeArgs eType="Replay" icon="8" nRep="22" Source="login" SourceLine="6" >
<Disp><![CDATA[numOfTickets.Select]]></Disp>
</NodeArgs>
</Step>
<Step rID="T13">
<Obj plainTxt="False" ><![CDATA[FIND FLIGHTS.Click]]></Obj>
<Details plainTxt="False" ><![CDATA[]]></Details>
<Time><![CDATA[10-02-2023 - 10:45:23]]></Time>
<TimeTick>1676006123</TimeTick>
<NodeArgs eType="Replay" icon="7" nRep="24" Source="login" SourceLine="7" >
<Disp><![CDATA[FIND FLIGHTS.Click]]></Disp>
</NodeArgs>
</Step>
<Step rID="T14">
<Obj plainTxt="False" ><![CDATA[flightsDataGrid.SelectCell]]></Obj>
<Details plainTxt="False" ><![CDATA[4, 0]]></Details>
<Time><![CDATA[10-02-2023 - 10:45:23]]></Time>
<TimeTick>1676006123</TimeTick>
<NodeArgs eType="Replay" icon="9" nRep="26" Source="login" SourceLine="8" >
<Disp><![CDATA[flightsDataGrid.SelectCell]]></Disp>
</NodeArgs>
</Step>
<Step rID="T15">
<Obj plainTxt="False" ><![CDATA[SELECT FLIGHT.Click]]></Obj>
<Details plainTxt="False" ><![CDATA[]]></Details>
<Time><![CDATA[10-02-2023 - 10:45:24]]></Time>
<TimeTick>1676006124</TimeTick>
<NodeArgs eType="Replay" icon="7" nRep="28" Source="login" SourceLine="9" >
<Disp><![CDATA[SELECT FLIGHT.Click]]></Disp>
</NodeArgs>
</Step>
<Step rID="T16">
<Obj plainTxt="False" ><![CDATA[passengerName.Set]]></Obj>
<Details plainTxt="False" ><![CDATA["manichandan"]]></Details>
<Time><![CDATA[10-02-2023 - 10:45:24]]></Time>
<TimeTick>1676006124</TimeTick>
<NodeArgs eType="Replay" icon="6" nRep="30" Source="login" SourceLine="10" >
<Disp><![CDATA[passengerName.Set]]></Disp>
</NodeArgs>
</Step>
<Step rID="T17">
<Obj plainTxt="False" ><![CDATA[ORDER.Click]]></Obj>
<Details plainTxt="False" ><![CDATA[]]></Details>
<Time><![CDATA[10-02-2023 - 10:45:25]]></Time>
<TimeTick>1676006125</TimeTick>
<NodeArgs eType="Replay" icon="7" nRep="32" Source="login" SourceLine="11" >
<Disp><![CDATA[ORDER.Click]]></Disp>
</NodeArgs>
</Step>
<Step rID="T18">
<Obj plainTxt="False" ><![CDATA[NEW SEARCH.Click]]></Obj>
<Details plainTxt="False" ><![CDATA[]]></Details>
<Time><![CDATA[10-02-2023 - 10:45:25]]></Time>
<TimeTick>1676006125</TimeTick>
<NodeArgs eType="Replay" icon="7" nRep="34" Source="login" SourceLine="12" >
<Disp><![CDATA[NEW SEARCH.Click]]></Disp>
</NodeArgs>
</Step>
<Step rID="T19">
<Obj plainTxt="False" ><![CDATA[Micro Focus MyFlight Sample.Close]]></Obj>
<Details plainTxt="False" ><![CDATA[]]></Details>
<Time><![CDATA[10-02-2023 - 10:45:26]]></Time>
<TimeTick>1676006126</TimeTick>
<NodeArgs eType="Replay" icon="5" nRep="36" Source="login" SourceLine="13" >
<Disp><![CDATA[Micro Focus MyFlight Sample.Close]]></Disp>
</NodeArgs>
</Step>
<NodeArgs eType="Context" icon="5" nRep="9" Source="login" SourceLine="0" >
<Disp><![CDATA[Micro Focus MyFlight Sample]]></Disp>
</NodeArgs>
</Step>
<Summary sTime="10-02-2023 - 10:45:17" eTime="10-02-2023 - 10:45:26" passed="0" failed="0" warnings="0" ></Summary>
<NodeArgs eType="StartAction" icon="4" nRep="7" >
<Disp><![CDATA[login Summary]]></Disp>
</NodeArgs>
</Action>
<NodeArgs eType="StartIteration" icon="3" nRep="6" >
<Disp><![CDATA[demo_1 Iteration 1 (Row 1)]]></Disp>
</NodeArgs>
</DIter>
<Summary sTime="10-02-2023 - 10:45:15" eTime="10-02-2023 - 10:45:26" passed="0" failed="0" warnings="0" ></Summary>
<NodeArgs eType="StartTest" icon="1" nRep="3" >
<Disp><![CDATA[Test demo_1 Summary]]></Disp>
</NodeArgs>
</Doc>
</Report>